[
  {
    "disruption_id": "DIS-000101",
    "event_type": "Weather",
    "severity": "High",
    "root_cause": "Weather",
    "flight_id": "FL-10001",
    "affected_flights": ["FL-10001", "FL-10077"],
    "start_utc": "2026-06-12T14:05:00Z",
    "end_utc": "2026-06-12T16:00:00Z",
    "details": {
      "delay_minutes": 115,
      "is_cancellation": false,
      "description": "Thunderstorm cell over transatlantic corridor reduced departure slots.",
      "affected_airports": ["JFK", "LHR"],
      "compensation_hint": "MealAndHotel"
    }
  },
  {
    "disruption_id": "DIS-000102",
    "event_type": "Crew",
    "severity": "Medium",
    "root_cause": "CrewLegalLimit",
    "flight_id": "FL-10002",
    "affected_flights": ["FL-10002"],
    "start_utc": "2026-06-12T20:40:00Z",
    "end_utc": "2026-06-12T23:00:00Z",
    "details": {
      "delay_minutes": 95,
      "is_cancellation": false,
      "description": "Inbound crew exceeded duty-time limit and reserve assignment required.",
      "affected_airports": ["LHR"],
      "compensation_hint": "MealOnly"
    }
  },
  {
    "disruption_id": "DIS-000103",
    "event_type": "Cancellation",
    "severity": "Critical",
    "root_cause": "Technical",
    "flight_id": "FL-10110",
    "affected_flights": ["FL-10110", "FL-10135"],
    "start_utc": "2026-06-13T05:20:00Z",
    "details": {
      "delay_minutes": 0,
      "is_cancellation": true,
      "description": "Aircraft grounded due to unscheduled maintenance with no spare available.",
      "affected_airports": ["CDG", "FRA"],
      "compensation_hint": "FullRefund"
    }
  }
]
